34|Có dịch vụ vận chuyển hàng hóa về đến nhà riêng hay không
34|Nhà tôi ở xa sân bay, hãng có dịch vụ trung chuyển về đến nhà hay không
34|Tôi có chuyển lô hàng lớn từ Đà Nẵng đi Hà Nội, hãng có dịch vụ trung chuyển về đến nhà không
34|Có dịch vụ vận chuyển hàng hóa từ sân bay về đến nhà riêng không
34|Bên mình có cung cấp dịch vụ vận chuyển từ cửa đến cửa không
34|Bên mình có dịch vụ trung chuyển từ sân bay về đến nhà riêng hay không
34|Tôi cần xe trung chuyển từ sân bay đến khách sạn có được không
34|Nhà tôi ở xa sân bay, vậy bên hãng có dịch vụ từ cửa đến cửa hay không
34|Mình có phương tiện để trung chuyển hay không
34|Có xe để đưa đón từ khách sạn đến sân bay hay không
34|Có phương tiện để đưa đón từ nhà riêng đến sân bay không vậy
34|Tôi có mang hàng hóa cồng kềnh, vậy bên mình có dịch vụ vận chuyển đến nhà không
34|Có dịch vụ trung chuyển khách từ sân bay về nhà riêng hay không
34|Có xe đưa đón khách khi đi máy bay không
34|Tôi muốn sử dụng dịch vụ từ cửa đến cửa của hãng thì làm sao
35|Tôi có thể lấy nhãn nhận biết hàng hóa ở đâu cho lô hàng vận chuyển trên chuyến bay
35|Nhãn nhận biết hàng hóa sẽ lấy ở đâu
35|Tôi sử dụng mẫu nhãn nhận dạng hàng hóa của riêng công ty được không
35|Tôi tự thiết kế mẫu nhãn nhận dạng hàng hóa của riêng được không
35|Mẫu nhãn nhận dạng hàng hóa có cần dùng mẫu thống nhất không
35|Nhãn nhận biết hàng hóa tôi có thể lấy mẫy này ở đâu
35|Lô hàng vận chuyển trên chuyến bay có cần mẫu nhận dạng hàng hóa hay không
35|Tôi có một lô hàng cần gửi đi, vậy tôi có thể lấy mẫu nhận dạng hàng ở đâu
35|Tôi có thể sử dụng mẫu nhãn nhận dạng do mình tự thiết kế hay không
35|Sử dụng nhãn nhận dạng hàng hóa do công ty tôi tự thiết kế có được không
35|Mẫu nhận biết hàng hóa dùng cho lô hàng vận chuyển trên chuyến bay đúng không
35|Lô hàng khi vận chuyển trên chuyến bay có cần dán nhãn nhận biết gì không
35|Có chấp nhận các mẫu nhãn nhận dạng do khách hàng cung cấp hay không
35|Khách hàng có thể tự thiết kế mẫu nhãn nhận dạng hàng hóa hay không
35|Có phải mẫu nhận dạng hàng dùng để dán lên các lô hàng đúng không
35|Hãng có thống nhất chung mẫu cho nhãn nhận dạng các lô hàng hay không
35|Các mẫu nhận dạng hàng hóa có quy định chung gì không
35|Tôi có gói hàng cần vận chuyển thì có cần dán nhãn nhận dạng gì không
35|Gói hàng của tôi, tôi tự ghi dấu nhận hàng hàng hóa có được không
35|Hãng có phát hành mẫu nhãn nhận biết hàng hóa hay không
