18|Tôi có thể sử dụng đá khô để đóng gói hàng hóa hay không
18|Nhiệt độ trên máy bay có thể hạ thấp xuống âm độ hay không
18|Tôi mang theo hàng cần phải bảo quản ở nhiệt độ thấp có được không
18|Trên tàu bay có để ở nhiệt độ âm không
18|hàng thủy sản nhưng chưa được ướp lạnh thì có mang lên máy bay được không
18|Tôi muốn mang theo tôm tươi nhưng không dùng các biện pháp trữ lạnh có được không
18|Cá đông lạnh có thể vận chuyển trên khoang máy bay hay không
18|Tôi bị ốm nên nhiệt độ âm tôi sẽ bị phát bệnh, vậy tôi có đi máy bay được không
18|Hàng đông lạnh muốn vận chuyển trên máy bay thì phải làm sao
18|Nhiệt độ âm trên tàu bay thấp nhất là bao nhiêu
18|Trên tàu bay có để nhiệt độ lạnh, dưới 0 độ hay không
18|hàng hóa cần đông lạnh thì phải làm sao
18|Tôi phải làm sao để mang theo hàng đông lạnh
19|bay trực tiếp đến những điểm nào
19|máy bay có thể bay thẳng đến đâu
19|bay thẳng đến được những nơi nào
19|Có bay trực tiếp đến châu âu hay không
19|Có bay trực tiếp đến châu á hay không
19|Có bay trực tiếp đến châu úc hay không
19|Có bay thẳng đến tất cả các sân bay nội địa của việt nam không
19|các sân bay nội địa của việt nam có chuyến bay thẳng đến không
19|các sân bay nội địa của việt nam có chuyến nào phải trung chuyển hay không
19|Các chuyến bay của hãng có bay trực tiếp đến các châu lục hay không
19|Khu vực nào trên thế giới có chuyến bay trực tiếp
19|Thành phố nào ở Việt Nam có chuyến bay trực tiếp
19|Những điểm nào mà hãng có chuyến bay trực tiếp
19|Những sân bay ở địa phương nào mà hãng không bay trực tiếp đến
19|Ở Châu Âu, hãng có bay trực tiếp đến hay không
19|Ở Châu Á, hãng có bay trực tiếp đến hay không
19|Ở Châu Úc, hãng có bay trực tiếp đến hay không
19|Tôi muốn đi Nha Trang thì có chuyến bay nào bay trực tiếp hay không
19|Việt Nam đi các nước Châu Âu, có chuyến bay nào bay thẳng hay không
19|Có chuyến bay nào bay trực tiếp từ Việt Nam đi các nước Châu Úc hay không 
20|Có giống chó nào không được vận chuyển trên chuyến bay dưới dạng hàng hóa
20|Có giống chó nào tôi không gửi được hay không
20|Hàng hóa của tôi có chứa động vật như là chó có được không
20|Tôi muốn gửi chó qua đường hàng hóa
20|Tôi đưa chó lên máy bay theo đường hàng hóa
20|Chó hung dữ bị cấm vận chuyển không
20|Tôi có thể mang lên máy bay các giống chó hung dữ hay không
20|Tôi có thể đưa giống chó bulldog theo không
20|Tôi có thể đưa chó terrier theo lên tàu bay không
20|Tôi có thể đưa giống chó boxer theo lên tàu bay không
20|Tôi có thể đưa chó pug theo hay không
20|Hãng có nhận vận chuyển giống chó pug không
20|Hãng có nhận vận chuyển các giống chó hung dữ không
20|Tôi muốn gửi dưới dạng hàng hóa một vài con chó có được không
20|Mình muốn gửi chó theo đường hàng hóa có được không
20|Những dòng chó nào bị cấm vận chuyển
20|Giống chó nào không nhận vận chuyển
20|Chó bẹc rê có thể gửi trên máy bay theo đường hàng hóa được không
20|Hãng cấm vận chuyển những giống chó nào
20|Chó có mang được lên máy bay không
21|sử dụng sân bay nào là sân bay trung tâm cho vận chuyển mặt đất
21|Sân bay trung tâm cho vận chuyển mặt đất là sân bay nào
21|Sân bay trung tâm nằm ở đâu vậy
21|sân bay chính cho vận chuyển dưới đất là nơi nào
21|sân bay chính cho vận chuyển dưới mặt đất là vị trí nào
21|sân bay chính để vận chuyển mặt đất là
21|Mạng vận chuyển mặt đất của hãng bao gồm các điểm đến xuất phát từ đâu
21|Mạng vận chuyển mặt đất chính bao gồm các điểm đến ở đâu
21|Sân bay chính của hãng tại Châu Âu là những sân bay nào
21|Những sân bay nào tại Châu Âu là sân bay chính của hãng
21|Sân bay chính của hãng tại Úc là những sân bay nào
21|Những sân bay nào tại Nhật bản là sân bay chính của hãng
21|Sân bay fukuoka tại Nhật có phải là sân bay chính không
21|Frankfurt có phải là sân bay trung tâm của hãng hay không
21|Tại các thành phố lớn nào tại Nhật bản có sân bay trung tâm của hãng
21|Cho biết danh sách các sân bay trung tâm tại Úc
21|Tại Châu Âu, hãng có những sân bay trung tâm nào
21|Tôi muốn bay từ Nhật về Việt Nam, xin hỏi có sân bay osaka có phải là sân bay trung tâm hay không
21|Osaka có phải là sân bay trung tâm hay không
21|Các điểm đến xuất phát chính từ đâu trong mạng vận chuyển mặt đất của hãng
22|Làm thế nào để gửi hàng đến những điểm mà vienam airlines không có đường bay
22|Những nơi máy bay không bay tới thì tôi có gửi hàng được không
22|gửi hàng đến nơi không có đường bay
22|có dịch vụ vận chuyển bằng xe tải không
22|Bên Nhật có dịch vụ vận chuyển hàng hóa nào khác không
22|Có dịch vụ vận chuyển bằng xe tải từ campuchia về việt nam không
22|Những điểm mà hãng không có đường bay thì làm sao để gửi hàng đến đó
22|Tôi muốn gửi hàng đi Lào nhưng hãng không có đường bay thì làm sao
22|Tôi có lô hàng cần chuyển sang Nhật, nhưng tại địa phương đó không có đường bay thẳng thì làm sao
22|Những địa phương không có đường bay thẳng thì làm sao để gửi hàng đến đó được
22|Mình có dịch vụ trung chuyển hàng bằng xe tải không
22|Hàng gửi đi từ Đà Nẵng đến Đồng Nai, nhưng không có chuyến bay thẳng đến Đồng Nai thì làm sao
22|Có dịch vụ trung chuyển hàng hóa bằng xe tải không
22|Tôi cần xe tải để trung chuyển hàng từ Đồng Nai về Sài Gòn có được không
22|Ở Đồng Nai không có đường bay đến thì làm sao có thể gửi hàng đến đó
22|Tôi muốn gửi hàng đến những thành phố không có đường bay thẳng thì làm sao
22|Những thành phố không có đường bay thẳng thì tôi có thể gửi hàng đến đó không
22|Ở Châu Âu có dịch vụ vận chuyển bằng xe tải hay không
22|Tôi muốn gửi một kiện hàng đi Úc, nhưng ở thành phố đó không có sân bay thì làm sao
22|Tôi đang ở thành phố Osaka Nhật, tôi muốn gửi hàng về Việt Nam nhưng ở đây không có chuyến bay thẳng
23|Có yêu cầu đặc biệt gì đối với việc vận chuyển ống không
23|Cho tôi xin thông tin về vận chuyển ống
23|yêu cầu đặc biệt đối với vận chuyển bằng đường ống
23|vận chuyển ống với số lượng lớn có được không
23|hàng hóa dạng ống có cần đóng gói không
23|các ống nước có cần đóng kiện không
23|vận chuyển ống có cần phải đóng thành từng kiện không
23|Có quy định gì đối với việc vận chuyển ống hay không
23|Tôi có một lô hàng gồm nhiều ống nước, có kích thước lớn thì có vận chuyển được không
23|Có nhận vận chuyển lô hàng gồm nhiều ống nước, có kích thước lớn hay không
23|Các ống kim loại, tôi có cần phải đóng thành kiện hay không
23|Có cần phải dùng dây cứng để buộc các kiện hàng gồm các ống nước không
23|Có nhận vận chuyển số lượng nhiều các vật tư xây dựng hình ống hay không
23|Người gửi có cần phải đóng ống thành từng kiện đối với hàng hóa có hình ống hay không
23|Đối với hàng hóa có hình ống, tôi có cần phải cột các ống thành bó hay không
23|Các ống tiếp nước, tôi có cần phải cột thành từng kiện rời không
23|Có cần phải đóng gói hàng hóa có hình dạng ống hay không
23|Tầm 100 ống nước, dài dưới 10m thì có vận chuyển không
23|Tôi muốn gửi qua đường hàng hóa tầm 100 ống thép thì phải làm sao
23|Để vận chuyển qua đường hàng hóa tầm 100 ống inox thì cần thủ tục gì không
24|có vận chuyển hàng chuyển phát nhanh từ việt nam đến các nước khác không
24|Tôi muốn chuyển hàng nhanh ra nước ngoài
24|chuyển phát nhanh đến các nước khác
24|muốn chuyển phát nhanh từ đà nẵng đi nha trang có được không
24|có dịch vụ chuyển phát nhanh không
24|Tôi có thể gửi hàng chuyển nhanh ra nước ngoài được không
24|Hãng có nhận chuyển phát nhanh hàng hóa ra nước ngoài không
24|Tôi muốn chuyển nhanh lô hàng từ Sài Gòn về Đà Nẵng có được không
24|Hãng có nhận hàng chuyển phát nhanh từ Đà Nẵng đi Nha Trang không
24|Hãng nhận chuyển phát nhanh đến những nơi nào
24|Có nhận chuyển phát nhanh ra nước ngoài hay không
24|Tôi muốn gửi hàng chuyển nhanh đi Nhật có được không
24|Những ga hàng hóa nào mà hãng có nhận hàng chuyển phát nhanh
24|Hãng nhận hàng chuyển phát nhanh tại những ga nào
24|Mình muốn chuyển phát nhanh hàng từ Châu Âu về Việc Nam có được không
24|Em có lô hàng từ Nhật cần chuyển nhanh về Đà Nẵng thì thủ tục như thế nào
24|Anh chị có thể hướng dẫn cách gửi hàng chuyển phát nhanh từ Nha Trang về Đà Nẵng không
24|Để gửi hàng chuyển phát nhanh từ Nha Trang về Đà Nẵng thì lệ phí bao nhiêu
24|Lệ phí để chuyển hàng chuyển phát nhanh từ Việt Nam ra nước ngoài là bao nhiêu
24|Chuyển phát nhanh hàng hóa từ Việt Nam ra nước ngoài thì tính phí như thế nào
25|Có chấp nhận vận chuyển động vật sống yêu cầu một nhiệt độ cố định không
25|Tôi muốn chuyển thú nuôi và cần nhiệt độ ổn định có được không
25|Kho hàng có nhiệt độ ổn định không
25|Có duy trì nhiệt độ cho kho hàng không
25|Mình có hàng hóa cần nhiệt độ cố định không thì có vận chuyển được không
25|Có một nhiệt độ cố định trên tàu bay để chuyển động vật sống không
25|Tôi sợ nóng để gửi chó cảnh lên tàu bay, vậy trên đó có giữ nhiệt độ ổn định hay không
25|Có nhiệt độ cố định để đảm bảo sức khỏe cho vật nuôi khi vận chuyển không
25|Động vật sống cần nhiệt độ cố định thì hãng có nhận vận chuyển hay không
25|Tôi cần vận chuyển giống mèo cảnh, trên tàu có nhiệt độ tầm 5 độ C không
25|Trên máy bay có nhiệt độ tầm từ 5 đến 10 độ C để đảm bảo sức khỏe cho vật nuôi không
25|Trên máy bay thường duy trì một nhiệt độ cụ thể nào đó không
25|Tôi có mang theo hàng sách tay là chuột cảnh, trên máy bay có nhiệt độ cố định không
25|Tôi cần duy trì nhiệt độ trên 15 độ C liên tục trên chuyến bay có được không
25|Trong hầm hàng có nhiệt độ cụ thể là bao nhiêu
25|Tôi có gửi hàng nhưng không biết trong hầm hàng có nhiệt độ ổn định hay không
25|Nhiệt độ trong hầm hàng của máy bay có luôn giữ nhiệt ổn định không
25|Trong khoang hàng hóa, tàu bay có giữ nhiệt độ cố định không
25|Tôi cần vận chuyển động vật sống, không biết trong khoang hàng có để nhiệt độ thấp dưới 5 độ không
25|Trong khoang hàng có để nhiệt độ thấp dưới 5 độ không
26|Có chấp nhận vận chuyển quan tài không
26|Có thể chuyển quan tài qua đường hàng không hay không
26|Tôi muốn máy bay chở quan tài thì nên tham khảo điều kiện ở đâu
26|chuyển hài cốt được không
26|chuyển xác chết được không
26|điều kiện để vận chuyển quan tài là gì
26|Người chết do dịch bệnh thì có vận chuyển không
26|Cần làm thủ tục trước bao lâu để vận chuyển quan tài nếu nguyên nhân chết do dịch bệnh
26|Chuyển người chết do dịch bệnh không
26|Cần làm thủ tục trước bao lâu để vận chuyển hài cốt
26|Thủ tục để vận chuyển quan tài nếu nguyên nhân chết do dịch bệnh là gì
26|Thủ tục để vận chuyển xác chết do dịch bệnh là gì
26|Cần làm thủ tục trước bao lâu để vận chuyển quan tài
26|Vận chuyển quan tài có được phép không
26|Cần làm thủ tục trước bao lâu để vận chuyển xác chết
26|Có chấp nhận vận chuyển quan tài nếu nguyên nhân chết do dịch bệnh không
26|Cần làm thủ tục trước bao lâu để vận chuyển người chết do dịch bệnh
26|Điều kiện để vận chuyển xác chết do dịch bệnh là gì
26|Vận chuyển xác chết do dịch bệnh có được không
26|Người chết do dịch bệnh có được mang lên máy bay không
27|Tôi có thể sử dụng phương tiện vận chuyển nào cho lô hàng vận chuyển từ campuchia đến các điểm đến
27|Tôi muốn chuyển hàng từ campuchia đến việt nam thì có thể dùng phương tiện nào
27|Có xe trung chuyển từ campuchia về việt nam không
27|Tôi muốn bay từ campuchia về việt nam có được không
27|Từ campuchia về việt nam có chuyến bay nào không
27|Tôi ở campuchia, muốn sử dụng dịch vụ của vietnam airlines thì làm sao
27|Thủ tục để bay từ Campuchia về Việt nam là gì
27|Để vận chuyển lô hàng từ Campuchia về Việt Nam, tôi có cần dùng hộ chiếu không
27|Tôi có phải trả nhiều phí cho lô hàng vận chuyển từ Campuchia về Việt Nam không
27|Tôi muốn biết thông tin về chi nhánh hay đại lý Vietnam airline tại Campuchia
27|Có được vận chuyển lô hàng chất lỏng từ Campuchia về Việt Nam không
27|Chuyến bay sớm nhất từ Campuchia về Việt nam là chuyến bay lúc mấy giờ
27|Chuyến bay muộn nhất từ Campuchia về Việt nam là chuyến bay lúc mấy giờ
27|Tôi có mú vé máy bay online để vận chuyển lô hàng từ Campuchia về Việt Nam hay không
27|Thủ tục để sử dụng các chuyến bay và dịch vụ mặt đất của vietnam airline
27|Tôi có thể nối chuyến các chuyến bay của Vietnam airline được không
27|Phương tiện vận chuyển nào là tối ưu nhất để vận chuyển lô hàng từ Campuchia về Việt Nam
27|Tôi có thể sử dụng dịch vụ vận chuyển mặt đất của Vietnam airline để vận chuyển hàng được không
27|Hàng ngày có mấy chuyến bay từ Campuchia về Việt Nam
27|Tôi có thể sử dụng phương tiện công cộng từ campuchia để vận chuyển lô hàng về Việt Nam được không
28|có vận chuyển động vật có vú không
28|Gửi chó qua đường máy bay có được không
28|động vật có vú có mang lên máy bay được không
28|lợn có vận chuyển trên máy bay không
28|những động vật có vú nào không vận chuyển được
28|Có vận chuyển động vật có vú có trọng lượng 50kg trở lên không
28|Có vận chuyển lợn trên 50 ký không
28|Có vận chuyển cá voi trên 50 ký không
28|Vì sao không chấp nhận vận chuyển động vật có vú từ 50 ký trở lên
28|Động vật có vú hãng có nhận vận chuyển không
28|Tôi có thể gửi động vật có vú qua đường hàng hóa hay không
28|Đường hàng hóa có vận chuyển được động vật có vú hay không
28|Tôi có thể gửi mèo cảnh theo đường hàng hóa hay không
28|Chó cảnh có mang lên máy bay được không
28|Tôi cần vận chuyển một con cá voi, hãng có nhận không 
28|Tôi có lô heo giống cần vận chuyển về Việc Nam theo đường hàng hóa có được không
28|Tôi đi nước ngoài có mang theo mèo cảnh thì có được không
28|Những động vật có vú nào hãng nhận vận chuyển
28|Cá heo được đóng kiện gửi theo đường hàng hóa có được không
28|Hãng có nhận vận chuyển cá heo theo đường hàng hóa không
29|Có vận chuyển động vật sống trên tất cả các tàu bay
29|Máy bay của hãng có vận chuyển động vật sống
29|Động vật nào được mang lên máy bay
29|Mình muốn mang động vật lên máy bay
29|máy bay nào cũng có thể chuyển con vật sống
29|Có phải trên tất cả các tàu bay của hãng có vận chuyển động vật sống phải không
29|Động vật sống tôi có thể gửi ở mọi chuyến bay đúng không
29|Tôi có thể gửi động vật sống ở chuyến bay nào cũng được phải không
29|Tôi có vài con chó cảnh, tôi có thể gửi hàng hóa ở chuyến bay nào cũng được à
29|Loài động vật nào tôi có thể mang lên máy bay
29|Loài động vật nào tôi có thể gửi theo đường hàng hóa
29|Những động vật nào tôi có thể vận chuyển bằng máy bay
29|Theo đường hàng hóa, hãng có thể nhận những động vật nuôi nào
29|Tôi có chó cảnh cần gửi theo đường hàng không có được không
29|Hãng có nhận vận chuyển chó cảnh không
29|Tôi có lô hàng mèo giống cần nhập từ nước ngoài về, hãng có nhận vận chuyển không
29|Minh đi các chuyến bay trong nước thì có thể mang theo động vật sống không
29|Chó nuôi tôi có thể mang lên các chuyến bay trong nước chứ
29|Tôi đi nước ngoài thì có thể mang động vật sống theo có được không
29|Tôi có thể mang động vật sống trên các chuyến bay ra nước ngoài không
30|Có yêu cầu gì đối với vận chuyển hàng hóa có vật liệu giữ lạnh như đá khô, khí hóa lỏng làm lạnh, đá ướt
30|Hàng hóa có những nguyên liệu giữ lạnh đi kèm thì cần yêu cầu gì không
30|Hàng có đá ướt có thể mang lên máy bay được không
30|yêu cầu đối với hàng có đá khô
30|yêu cầu đặc biệt với hàng có kèm đá ướt
30|Có quy định gì đối với hàng hóa có vật liệu giữ lạnh như đá khô không
30|Đối với hàng hóa có vật liệu giữ lạnh như khí hóa lỏng làm lạnh thì có quy định gì không
30|Có hướng dẫn gì đối với hàng có vật liệu giữ lạnh như đá ướt không
30|Có yêu cầu chi đặc biệt với hàng hóa cần trữ lạnh không
30|Có yêu cầu cụ thể gì đối với vận chuyển hàng hóa có vật liệu giữ lạnh không
30|Hàng có vật liệu giữ lạnh thì có cần đánh dấu hàng mau hỏng hay không
30|Lô hàng được ướp lạnh bằng đá thì có cần dán thêm nhãn gì không vậy
30|Cá đông lạnh có cần đóng gói theo quy định nào không
30|Có cần phải đóng gói các lô hàng hóa được ướp lạnh bằng đá khô không
30|Có yêu cầu cụ thể nào khi đóng gói hay dán nhãn với hàng hóa đông lạnh không
30|Hàng hóa có khí hóa lỏng làm lạnh thì có yêu cầu cụ thể khi đóng gói hay dán nhãn hay không
30|Có yêu cầu cụ thể khi đóng gói hay dán nhãn đối với lô hàng có đá ướt làm lạnh không
30|Trong trường hợp nào thì yêu cầu phải đóng gói hay dán nhãn cẩn thận
30|Khi nào thì tôi phải dán nhãn và đánh dấu là hàng hóa mau hỏng
30|Tôi có cần phải dán nhãn hàng mau hỏng đối với hàng đông lạnh không
31|Có nhận vận chuyển khỉ hay không
31|Khỉ có gửi qua đường hàng hóa được không
31|Thú nuôi của tôi là khỉ thì có được vận chuyển đi cùng bằng máy bay không
31|Có vận chuyển khỉ không
31|Khỉ dưới 6 tuổi có mang lên máy bay được không
31|Gửi ký gửi khỉ nuôi có được không
31|Khỉ dùng cho mục đích thí nghiệm thì có vận chuyển không
31|Hãng có vận chuyển khỉ dùng cho mục đích thí nghiệm không
31|Tôi có lô hàng là khỉ cần vận chuyển từ nước ngoài về thì có vận chuyển không
31|Hãng có vận chuyển khỉ từ nước ngoài về Việt Nam không
31|Khỉ nuôi được tầm 3 tháng tuổi thì có mang lên máy bay được không
31|Tôi cần nhập khẩu khỉ về cho phòng thí nghiệm thì hãng có nhận vận chuyển không
31|Điều kiện chấp nhận hàng động vật sống như khỉ là gì
31|Động vật như khỉ có được chấp nhận vận chuyển trên các chuyến bay hay không
31|Các chuyến bay của hãng có chấp nhận vận chuyển động vật như khỉ không
31|hãng có nhận vận chuyển khỉ sử dụng phòng thí nghiệm hay không
31|Hãng có nhận vận chuyển lô hàng là khỉ từ nước ngoài hay không rứa
31|Khỉ dưới bao nhiêu tuổi thì có thể gửi hàng hóa về Việc Nam
31|Khi nhập khẩu khỉ từ nước ngoài về cho những mục đích gì thì có thể nhận vận chuyển
31|Những loài khỉ nào thì tôi có thể vận chuyển bằng đường hàng không
32|Trọng lượng tối đa của 1 kiện hàng thông thường trên các chuyến bay là bao nhiêu
32|Hàng hóa bao nhiêu ký thì có thể đi trên chuyến bay
32|Hàng hóa trọng lượng tối đa bao nhiêu kg là có thể đem lên máy bay
32|kiện hàng thông thường trên máy bay nặng bao nhiêu
32|kiện hàng thông thường trên mỗi chuyến nặng bao nhiêu
32|Khối lượng tối đa một thùng hàng trên các chuyến bay là bao nhiêu vậy
32|Trên các chuyến bay có giới hạn trọng lượng các thùng hàng hay không
32|Tôi có kiện hàng 20 kg thì có thể gửi lên máy bay được không
32|Tôi có các kiện hàng rời, thì khối lượng tối đa của các kiện là bao nhiêu là được
32|Lô hàng của tôi trên 50 ký thì có nhận vận chuyển không
32|Hãng có nhận vận chuyển các kiện hàng trên 50 kg hay không
32|Có giới hạn gì về khối lượng của hàng hóa hay không
32|Hàng hóa có bị giới hạn về trọng lượng khi gửi qua đường hàng không hay không
32|Mỗi lô hàng khi gửi đi thông thường có giới hạn tối đa bao nhiêu ký
32|Tôi có nhiều thùng hàng cần vận chuyển về Đà Nẵng, hãng có giới hạn gì về khối lượng không
32|Khối lượng tối đa cho phép trên mỗi thùng hàng là bao nhiêu vậy
32|Khi gửi hàng ra nước ngoài, hãng có giới hạn trọng lượng tối đa hay không
32|Hàng có có bị giới hạn trọng lượng khi gửi hàng ra nước ngoài không
32|Có quy định cụ thể gì về khối lượng hàng hóa khi vận chuyển trên các chuyến bay hay không
32|Trên các chuyến bay có quy định cụ thể gì về cân nặng của các lô hàng hóa không
33|Bản hướng dẫn của người gửi hàng là gì
33|Tôi muốn gửi hàng thì bản hướng dẫn của tôi sẽ như thế nào
33|Giấy hướng dẫn để gửi hàng là gì
33|Tài liệu áp dụng đối với người gửi hàng là gì
33|Tôi muốn gửi hàng thì bản hướng dẫn của tôi lấy mẫu ở đâu
33|Tài liệu áp dụng đối với đại lý là gì
33|Bản hướng dẫn dành cho công ty giao nhận là gì
33|Tài liệu sli là tài liệu gì
33|Những đối tượng nào thì cần sử dụng bản hướng dẫn sli
33|Tài liệu áp dụng đối với các đại lý là gì
33|Tôi muốn gửi hàng thì cần đọc bản hướng dẫn nào
33|Đối với đại lý thì có cần bản hướng dẫn nào không
33|Công ty tôi sử dụng mẫu sli tự thiết kế có được không
33|Những trường hợp nào thì cần phải có bản hướng dẫn của người gửi hàng
33|Người gửi hàng sử dụng bảng hướng dẫn để làm gì
33|Các đại lý sử dụng bảng hướng dẫn để làm gì
33|Các công ty giao nhận sử dụng bảng hướng dẫn để làm gì
33|Mục đích của bản hướng dẫn sli là gì
33|Bản hướng dẫn của người gửi hàng dùng để làm chi
33|Bản hướng dẫn sli dùng để làm gì
34|Có cung cấp dịch vụ vận chuyển đến tận nhà hay không
34|Tôi muốn chuyển hàng đến tận nhà
34|Vận chuyển hàng đến nhà riêng được không
34|Có dịch vụ vận chuyển từ cửa đến cửa không
34|Hãng có vận chuyển hàng về đến tận nhà không
